{
  "persons": [
    {
      "person": {
        "name_raw": "Ефимов Андрей Викторович",
        "role": "\n\n\n И.о. начальника Департамента\n"
      },
      "year": 2013,
      "incomes": [
        {
          "size": 7614.0,
          "size_raw": "7614",
          "relative": null
        }
      ],
      "real_estates": [
        {
          "text": "Земельный участок (под индивудуальное жилищное строительство)",
          "square": 951.0,
          "relative": null,
          "own_type_by_column": "В собственности",
          "square_raw": "951",
          "country_raw": "Россия"
        },
        {
          "text": "Жилой дом",
          "square": 327.2,
          "relative": null,
          "own_type_by_column": "В собственности",
          "square_raw": "327,2",
          "country_raw": "Россия"
        },
        {
          "text": "Квартира",
          "square": 74.9,
          "relative": null,
          "own_type_by_column": "В собственности",
          "square_raw": "74,9",
          "country_raw": "Россия"
        },
        {
          "text": "Квартиры",
          "square": 102.3,
          "relative": null,
          "own_type_by_column": "В собственности",
          "square_raw": "102,3",
          "country_raw": "Россия"
        },
        {
          "text": "Машина-место-бокс",
          "square": 15.9,
          "relative": null,
          "own_type_by_column": "В собственности",
          "square_raw": "15,9",
          "country_raw": "Россия"
        },
        {
          "text": "квартира",
          "square": 74.9,
          "relative": null,
          "own_type_by_column": "В пользовании",
          "square_raw": "74,9",
          "country_raw": "Россия",
          "type_raw": "квартира"
        }
      ],
      "vehicles": [
        {
          "text": "Автомобиль АУДИ",
          "relative": null
        }
      ],
      "person_index": 1
    }
  ],
  "document": {
    "sheet_title": " Сведения о доходах, расходах, об имуществе и обязательствах имущественного характера за период с 1 января 2013 г. по 31 декабря 2013 г. (терорганы) 14 | 05 | 14   13:05 №№ п/п Фамилия и инициалы лица,   чьи сведения размещаются Должность Объекты недвижимости,   находящиеся в собственности Объекты недвижимости, находящиеся в пользовании Транспортные средства (вид, марка) Декларированный годовой доход (руб.) Сведения об источниках получения средств, за счет   которых совершена сделка (вид приобретенного имущества, источники) вид объекта вид собственности площадь (кв. м) страна расположения 1. Ефимов Андрей Викторович И.о. начальника Департамента Земельный участок (под индивудуальное жилищное   строительство) Жилой дом Квартира Квартиры Машина-место-бокс 951 327,2 74,9 102,3 15,9 Россия квартира Автомобиль АУДИ 7614 несовершеннолетний ребенок нет ",
    "year": 2013
  }
}